eid	lid	row	text	source
Id762	Id1	13648	bandeja paisa is a typical colombian cuisine from paisa region . the main ingredients are "red beans, pork belly, white rice, ground meat, chicharon, fried egg, plantain (patacones), chorizo, arepa, hogao sauce, black pudding (morcilla), avocado and lemon" .	Bandeja_paisa country Colombian_cuisine . Bandeja_paisa ingredient Hogao . Bandeja_paisa mainIngredients "red_beans,_pork_belly,_white_rice,_ground_meat,_chicharon,_fried_egg,_plantain_(patacones),_chorizo,_arepa,_hogao_sauce,_black_pudding_(morcilla),_avocado_and_lemon" . Bandeja_paisa region Paisa_Region .
Id889	Id1	2285	united states air force is the operating organisation for al asad airbase and was involved in battles at invasion of grenada and operation enduring freedom . the lockheed ac-130 attack aircraft and the lockheed c-130 hercules transporter are planes of united states air force .	United_States_Air_Force attackAircraft Lockheed_AC-130 . United_States_Air_Force battles Invasion_of_Grenada . United_States_Air_Force battles Operation_Enduring_Freedom . Al_Asad_Airbase operatingOrganisation United_States_Air_Force . United_States_Air_Force transportAircraft Lockheed_C-130_Hercules .
Id619	Id1	10143	250 delaware avenue is located in united states , where english language is spoken and the leader has the title president of the united states . joe biden is one of the leaders .	United_States language English_language . United_States leaderName Joe_Biden . United_States leaderTitle President_of_the_United_States . 250_Delaware_Avenue location United_States .
Id133	Id1	17726	has to kerala northwest mahé, india .	Kerala has_to_its_northwest Mahé,_India .
Id1463	Id1	9233	i̇stanbulspor a.ş is associated with bebi dol , is part of k2 (kovač sisters duo) , and musical genre is pop music .	Aleksandra_Kovač associatedBand/associatedMusicalArtist Bebi_Dol . Aleksandra_Kovač associatedBand/associatedMusicalArtist K2_(Kovač_sisters_duo) . Aleksandra_Kovač genre Pop_music .
Id374	Id1	15298	william anders was a crew member on apollo 8 and was born in british hong kong .	William_Anders birthPlace British_Hong_Kong . William_Anders was_a_crew_member_of Apollo_8 .
Id740	Id1	10886	kochi is leader of kerala state where the association college with an academic staff of 250 is located in the city of "kuttikkattoor" .	AWH_Engineering_College academicStaffSize 250 . AWH_Engineering_College city "Kuttikkattoor" . Kerala leaderName Kochi . AWH_Engineering_College state Kerala .
Id438	Id1	6951	"associazione calcio lumezzane spa" is the full name of a.c. lumezzane who play in "lega pro/a" and have 4150 members .	A.C._Lumezzane fullname "Associazione_Calcio_Lumezzane_SpA" . A.C._Lumezzane league "Lega_Pro/A" . A.C._Lumezzane numberOfMembers 4150 .
Id569	Id1	8868	cookie and binignit are types of dessert . a key ingredient of binignit is sago .	Binignit course Dessert . Dessert dishVariation Cookie . Binignit ingredient Sago .
Id1861	Id1	4584	aaron turner plays electric guitar and played with black metal twilight (band) and the tamil man gloom . a fusion of black metal is called death metal .	Aaron_Turner associatedBand/associatedMusicalArtist Old_Man_Gloom . Aaron_Turner associatedBand/associatedMusicalArtist Twilight_(band) . Twilight_(band) genre Black_metal . Aaron_Turner instrument Electric_guitar . Black_metal musicFusionGenre Death_metal .
Id513	Id1	7559	serves both lake placid, new york and saranac lake, new york . the length of the runway at adirondack regional airport is 2003.0 .	Adirondack_Regional_Airport cityServed Lake_Placid,_New_York . Adirondack_Regional_Airport cityServed Saranac_Lake,_New_York . Adirondack_Regional_Airport runwayLength 2003.0 .
Id695	Id1	12532	al-taqaddum air base serves the city of fallujah , in iraq , where kurdish languages are spoken and fuad masum is the leader .	Al-Taqaddum_Air_Base cityServed Fallujah . Fallujah country Iraq . Iraq language Kurdish_languages . Iraq leaderName Fuad_Masum .
Id1042	Id1	17580	the related transport to alfa romeo 164 is lancia ( square kilometre .	Alfa_Romeo_164 relatedMeanOfTransportation Lancia_Thema .
Id40	Id1	18965	to the southeast of adams county, pennsylvania lies carroll county , maryland .	Adams_County,_Pennsylvania has_to_its_southeast Carroll_County,_Maryland .
Id414	Id1	7248	a severed wasp ( from united states ) is written in english language , which is the language spoken in great britain .	A_Severed_Wasp country United_States . A_Severed_Wasp language English_language . English_language spokenIn Great_Britain .
Id1796	Id1	1371	born on 1936-05-21 , in miri malaysia , abdul taib mahmud , lives in kuching . abdul taib mahmud party is parti pesaka bumiputera bersatu and abdul taib mahmud represented the asajaya region .	Abdul_Taib_Mahmud birthDate 1936-05-21 . Abdul_Taib_Mahmud birthPlace Miri,_Malaysia . Abdul_Taib_Mahmud party Parti_Pesaka_Bumiputera_Bersatu . Abdul_Taib_Mahmud region Asajaya . Abdul_Taib_Mahmud residence Kuching .
Id40	Id1	18965	to the southeast of adams county, pennsylvania lies carrol county , maryland .	Adams_County,_Pennsylvania has_to_its_southeast Carroll_County,_Maryland .
Id1523	Id1	6223	caterpillar inc. is found in illinois and caterpillar inc. powered african americans . aida cruises owns aidaluna .	Caterpillar_Inc. location Illinois . AIDAluna owner AIDA_Cruises . AIDAluna powerType Caterpillar_Inc. .
Id825	Id1	3812	dedicated to "ottoman army soldiers killed in the battle of baku" and located in baku is baku turkish martyrs memorial . baku is the capital of azerbaijan whose prime minister of azerbaijan and leader is artur rasizade .	Azerbaijan capital Baku . Baku_Turkish_Martyrs_Memorial dedicatedTo "Ottoman_Army_soldiers_killed_in_the_Battle_of_Baku" . Azerbaijan leaderName Artur_Rasizade . Azerbaijan leaderTitle Prime_Minister_of_Azerbaijan . Baku_Turkish_Martyrs_Memorial location Azerbaijan .
Id993	Id1	17881	"knightsbridge, london" is the birthplace of airey neave .	Airey_Neave birthPlace "Knightsbridge,_London" .
Id438	Id1	6951	"associazione calcio lumezzane spa" is the full name of a.c. lumezzane who play in "lega pro/a" and have 4150 members .	A.C._Lumezzane fullname "Associazione_Calcio_Lumezzane_SpA" . A.C._Lumezzane league "Lega_Pro/A" . A.C._Lumezzane numberOfMembers 4150 .
Id672	Id1	11926	peter stöger is the manager at 1. fc köln . peter stöger is a former player of sk vorwärts steyr , fc admira wacker mödling and fk austria wien .	Peter_Stöger club FC_Admira_Wacker_Mödling . Peter_Stöger club FK_Austria_Wien . Peter_Stöger club SK_Vorwärts_Steyr . 1._FC_Köln manager Peter_Stöger .
Id702	Id1	12240	bolt (comicscharacter) , who has the alternative name of "larry bolatinsky" , was created by gary cohn (comics) and the puerto ricans national , ernie colon .	Bolt_(comicsCharacter) alternativeName "Larry_Bolatinsky" . Bolt_(comicsCharacter) creator Ernie_Colón . Bolt_(comicsCharacter) creator Gary_Cohn_(comics) . Ernie_Colón nationality Puerto_Ricans .
Id1772	Id1	3162	alessio romagnoli is a defender who plays for u.c. sampdoria . alessio romagnoli also plays in serie a for a.c. milan who are managed by siniša mihajlović .	Alessio_Romagnoli club A.C._Milan . Alessio_Romagnoli club U.C._Sampdoria . A.C._Milan league Serie_A . A.C._Milan manager Siniša_Mihajlović . Alessio_Romagnoli position Defender_(football) .
Id262	Id1	16735	baked alaska comes from the country of france and one of the ingredients is sponge cake .	Baked_Alaska country France . Baked_Alaska ingredient Sponge_cake .
Id762	Id1	13648	bandeja paisa is colombian cuisine from paisa region . the main ingredients are "red beans, pork belly, white rice, ground meat, chicharon, fried egg, plantain (patacones), chorizo, arepa, hogao sauce, black pudding (morcilla), avocado and lemon" .	Bandeja_paisa country Colombian_cuisine . Bandeja_paisa ingredient Hogao . Bandeja_paisa mainIngredients "red_beans,_pork_belly,_white_rice,_ground_meat,_chicharon,_fried_egg,_plantain_(patacones),_chorizo,_arepa,_hogao_sauce,_black_pudding_(morcilla),_avocado_and_lemon" . Bandeja_paisa region Paisa_Region .
Id239	Id1	16271	atlantic city , new jersey is in united states , the capital of which is washington, d.c. .	United_States capital Washington,_D.C. . Atlantic_City,_New_Jersey country United_States .
Id881	Id1	1341	alan shepard was born in new hampshire ( united states ) and died in california . alan shepard was awarded distinguished service medal (united states navy) , which is higher than department of commerce gold medal .	Alan_Shepard awards Distinguished_Service_Medal_(United_States_Navy) . Alan_Shepard birthPlace New_Hampshire . Alan_Shepard deathPlace California . Distinguished_Service_Medal_(United_States_Navy) higher Department_of_Commerce_Gold_Medal . Alan_Shepard nationality United_States .
Id1091	Id1	18651	the manager of al-zawraa sc is basim qasim .	Al-Zawraa_SC manager Basim_Qasim .
Id262	Id1	16735	baked alaska comes from the country of france and one of the ingredients is sponge cake .	Baked_Alaska country France . Baked_Alaska ingredient Sponge_cake .
